{
  "schema_version": "1.0",
  "environment": "production",
  "event": "snapshot.published",
  "request_id": "publication-9556996690324e70ec37763907aec338",
  "snapshot_id": "ulyanovsk-second-cathedral-2026-pilot-local-v2",
  "snapshot_generated_at": "2026-08-29T12:16:00Z",
  "snapshot_sha256": "78233e7be3dd8ac9013ae8f44e8e2fdea587a3780b6dadabb97a290ed57ec50b",
  "canonical_sha256": "c650e4940bc6680ac5d88850f44f3dcb0110ae009e551b45f9bd8e15b54252df",
  "signing_key_id": "pilot-local-schedule-2026-02",
  "candidate_id": "candidate-e7bcc16ad55d00f136cbfc5629e2680b",
  "raw_sha256": "c7d95bbc900a683b3be4fa66f6d1a8237ccf3e882452674a2cdd946c800d935a",
  "transcription_sha256": "94ef664fafa69192992b7bc5b405baa6678d5a49c8f6b1c770c0281760d60e4f",
  "normalized_sha256": "e7bcc16ad55d00f136cbfc5629e2680babf3f71b331dd33ca4f6e1b1207dbf77",
  "diff_sha256": "de139a27b2f0f5b42253783f5a4aeca11d2f643bee572d860e2c4c24564d7e4e",
  "parser_version": "effective-schedule/v1",
  "approval_id": "approval-second-cathedral-mosque-ulyanovsk-2026-002",
  "approver_identity": "approver:ulyanovsk-mosques:akhmedov-elmaddin-fazil-ogly",
  "approved_at": "2026-08-29T12:12:00Z",
  "approval_scope": "Вторая Соборная мечеть Ульяновска; 2026 год; фото приоритетно для августа; азан Зухра — onset из источника; икамат Фаджра/Асра/Магриба/Иша — азан +5 мин; икамат Зухра ежедневно и Джума по пятницам — единое время 13:15; исключений Рамадана/праздников нет; предупреждения приняты.",
  "prayer_policy_sha256": "6b8ce3c01001d41162f18d5fb26d6a68251ce2d60a5f7598c5c96b06b51aa629",
  "approval_receipt_sha256": "36e889022c2db28ffa8221e1d104631f4a64f1c0d0211f89e942e4527453186c",
  "approval_trust_revision": 1,
  "approval_trust_sha256": "29ab69e969e75bee879cbe5f73993e711c160da754f4182653c32cb058ad2974",
  "approval_key_id": "ulyanovsk-approver-akhmedov-2026-01",
  "signer_identity": "signer:pilot-local:offline-operator",
  "published_at": "2026-08-29T12:18:00Z",
  "signed_at": "2026-08-29T12:17:00Z",
  "trust_bundle_revision": 3,
  "trust_bundle_sha256": "2fc9b7a34cbba4bf57ba5242aec6b782d41877ff6863006e83a3d40bc34eb085",
  "signing_request_sha256": "4ee1e7f39d9c834330de629f27521dac86b9f880e221b0749cc11ea29cc01435",
  "signing_request_id": "signing-72a58d54fd38a40ba3bcd5d0d2bca029",
  "attestation_ed25519_base64": "wLQ509l0ZyyKGE0hCW3P/nZ0+mRpe3JrT0EzyFLQtu33Cw5SVfecAnYFSF67OTWVkoL2Q+45BvDDzvBBHQ5TAA==",
  "previous_receipt_sha256": "96cecb7880673464c34ba44cf303c530c51a0afba854af7e0570b0947a74704b",
  "receipt_sha256": "9bbb6c80c102834654b4f8e09ff71d06fba03c4191a97eaaeb05f40c7189fe3c"
}
